Vocabulary,English,Thai,Example,Phonetic,Synonyms,Antonyms
insight,[N] a clear and deep understanding,[N] ความเข้าใจลึกซึ้ง,The report provides valuable insights.,ihnseyet,"discernment, penetration, perception",
inspect,[V] to check something carefully,[V] ตรวจสอบ,The building was inspected last week.,ihn-spehkt,"scrutinize, audit, visit",
instance,[N] an example or case,"[N] กรณี, ตัวอย่าง","For instance, we could try a different approach.",ihnstuhns,"case, exemplify, illustrate, representative, illustration",
integrate,[V] to put things together into one,[V] รวมเข้าด้วยกัน,We need to integrate the two systems.,ihntuhgrayt,"embody, fuse, merge, assimilate, incorporate",segregate
intend,[V] to plan to do something,"[V] ตั้งใจ, มุ่งหมาย",I intend to finish by Friday.,ihn-tehnd,"mean, think, designate, specify, signify",
intense,[Adj] very strong or serious,"[Adj] รุนแรง, เข้มข้น",The competition was intense.,ihn-tehns,"profound, vehement, keen, exquisite, sharp",mild
interpret,[V] to explain what something means / to translate,"[V] ตีความ, แปล",How do you interpret these results?,ihn-tɜ-priht,"decipher, elucidate, explain, expound, render",
investigate,[V] to look into something to find the truth,"[V] สืบสวน, ตรวจสอบ",The police are investigating the incident.,[ihn-ves-tih-gay̯t],look into,
itinerary,[N] a plan for a trip (where and when),[N] กำหนดการเดินทาง,Here's the itinerary for your trip.,eye-tihnuhri,"travel guidebook, travel plan",
complimentary,"[Adj] free, you don't pay / saying nice things","[Adj] ฟรี, ชมเชย",Breakfast is complimentary for all guests.,kahmpliḧ-mehnt(uh)ri,"free, gratuitous, laudatory, panegyrical, adulatory",uncomplimentary
expedite,[V] to make something happen faster,"[V] เร่ง, ทำให้เร็วขึ้น",Can you expedite the shipping?,ehk-spuh-deyet,hasten,
prospective,"[Adj] might happen in the future, possible",[Adj] ที่คาดว่าจะเป็น,We're meeting with prospective clients today.,pruh-spehktihv,"potential, expected, future, likely",retrospective
voucher,[N] a paper or code that gives you a discount,"[N] บัตรกำนัล, คูปอง",Use this voucher for a 10% discount.,vowchuh(r),coupon,
correspondence,[N] letters or emails between people,"[N] จดหมายโต้ตอบ, การติดต่อ",All correspondence should be sent to HR.,kahrih-spahnduhns,"balance, agreement, parallelism, map, symmetry","imbalance, asymmetry"
adjacent,[Adj] right next to,"[Adj] ติดกัน, ใกล้เคียง",The parking lot is adjacent to the building.,uh-yay-suhnt,"close, contiguous, near, connected, adjoining",
patron,[N] a regular customer or supporter,"[N] ลูกค้าประจำ, ผู้อุปถัมภ์",The restaurant thanks its loyal patrons.,pay-truhn,"supporter, sponsor, attender, frequenter, patronne",
no worries,"[Phrase] it's okay, don't worry about it",,"No worries, I'll handle it.",,,
my bad,"[Phrase] my mistake, sorry",,"Oh, my bad — I sent it to the wrong person.",,,
I'm swamped,[Phrase] I'm very busy,,Can we meet tomorrow? I'm swamped today.,,,
hang out,[PhV] to spend time casually,,Want to hang out after work?,,,
chill,[Adj/V] relaxed / to relax,,Let's just chill this weekend.,chihl,"cool, frisson, quiver, thrill, pall","heat, heat up, hot up"
a heads up,[Phrase] an advance warning,,Just a heads up — the meeting moved to 3 PM.,,,
no big deal,[Phrase] it's not important,,You forgot? No big deal.,,,
I'm down,"[Phrase] I agree, I want to join",,Dinner tonight? I'm down.,,,
for real,"[Phrase] seriously, truly",,For real? That's amazing!,,,
that makes sense,[Phrase] I understand now,,"Oh, that makes sense. Thanks for explaining.",,,
fair enough,"[Phrase] that's reasonable, I accept",,"Fair enough, let's do it your way.",,,
by the way,"[Phrase] also, additionally (BTW)",,"By the way, did you finish the report?",,,
kind of,"[Adv] somewhat, a little (kinda)",,I'm kind of tired today.,,,
figure out,"[PhV] to solve, understand",,I need to figure out how this works.,,,
mess up,[PhV] to make a mistake,,I messed up the order. Sorry!,,,
sort out,"[PhV] to organize, fix a problem",,Let me sort out the schedule first.,,,
end up,[PhV] to finally be in a situation,,We ended up staying until midnight.,,,
come up with,[PhV] to think of an idea,,She came up with a great solution.,,,
look into,"[PhV] to investigate, research",,I'll look into it and get back to you.,,,
run into,[PhV] to meet by chance,,I ran into our old colleague at the mall.,,,
catch up,"[PhV] to update each other, meet after a while",,Let's catch up over coffee sometime.,,,
keep up with,[PhV] to stay at the same level/pace,,It's hard to keep up with all the changes.,,,
put off,"[PhV] to postpone, delay",,Stop putting off the deadline.,,,
bring up,[PhV] to mention a topic,,She brought up a good point in the meeting.,,,
turn out,[PhV] the result was...,,It turned out better than expected.,,,
work out,[PhV] to exercise / to succeed,,I hope everything works out for you.,,,
get the hang of,[PhV] to learn how to do something,,You'll get the hang of it after a few tries.,,,
on the same page,"[Phrase] in agreement, same understanding",,Let's make sure we're on the same page.,,,
from scratch,"[Phrase] from the beginning, from zero",,I built this project from scratch.,,,
24/7,"[Phrase] all the time, always available",,The support team is available 24/7.,,,
touch base,[PhV] to briefly contact someone,,Let's touch base tomorrow morning.,,,
follow up,[PhV] to check on progress,,I'll follow up with the client next week.,,,
get back to,[PhV] to reply later,,Let me get back to you on that.,,,
wrap up,"[PhV] to finish, conclude",,Let's wrap up the meeting.,,,
fill in,"[PhV] to inform, or substitute for someone",,Can you fill me in on what I missed?,,,
take over,[PhV] to assume control,,She'll take over the project next month.,,,
carry out,"[PhV] to perform, execute",,We need to carry out the plan carefully.,,,
set up,"[PhV] to arrange, prepare",,I'll set up the meeting room.,,,
go over,[PhV] to review,,Let's go over the numbers one more time.,,,
point out,"[PhV] to indicate, highlight",,He pointed out several errors in the report.,,,
come across,[PhV] to find by chance / to seem,,She comes across as very confident.,,,
deal with,[PhV] to handle a situation,,How do you deal with difficult clients?,,,
cut back on,[PhV] to reduce,,We need to cut back on expenses.,,,
call off,[PhV] to cancel,,They called off the event due to rain.,,,
pull off,[PhV] to succeed at something difficult,,I can't believe we pulled it off!,,,
as per,[Prep] according to,,"As per our discussion, I've updated the file.",,,
please find attached,[Phrase] here is the file (email),,Please find attached the quarterly report.,,,
at your earliest convenience,[Phrase] as soon as you can (polite),,Please reply at your earliest convenience.,,,
I'd appreciate it if,[Phrase] polite request,,I'd appreciate it if you could review this.,,,
looking forward to,[Phrase] excited about (email closing),,Looking forward to hearing from you.,,,
with regard to,"[Prep] about, concerning",,"With regard to your request, we've approved it.",,,
for your reference,"[Phrase] FYI, for your information",,"For your reference, the policy has been updated.",,,
don't hesitate to,[Phrase] feel free to,,Don't hesitate to reach out if you need help.,,,
tbh,[Abbr] to be honest,,"Tbh, I didn't really like the movie.",,,
ngl,[Abbr] not gonna lie,,"Ngl, that presentation was really good.",,,
imo,[Abbr] in my opinion,,"Imo, we should go with option B.",,international maritime organization,
lmk,[Abbr] let me know,,Lmk if you're free this weekend.,,,
brb,[Abbr] be right back,,"Brb, grabbing coffee.",,,
fyi,[Abbr] for your information,,"Fyi, the deadline is next Friday.",,,
asap,[Abbr] as soon as possible,,Please send the report asap.,,,
gonna,[Slang] going to,,I'm gonna finish this tonight.,,,
wanna,[Slang] want to,,Wanna grab lunch?,,,
gotta,"[Slang] got to, have to",,I gotta go now. Talk later!,,,
gotcha,[Slang] I understand / I caught you,,"Gotcha, I'll fix it right away.",,,
nope,[Slang] no (casual),,"Nope, I haven't seen it yet.",nohp,,
yep,[Slang] yes (casual),,"Yep, sounds good to me.",yehp,,
