Vocabulary,English,Thai,Example,Phonetic,Synonyms,Antonyms
obsolete,"[Adj] too old, no one uses it anymore",,This technology is now obsolete.,ahbsuhlit,"abortive, obscure, rudimental, antiquated, deprecated",
penalty,"[N] a punishment, usually money you have to pay",,There's a penalty for late payment.,pehnuhlti,"punishment, punition, sentence",
personnel,[N] the people who work at a company,,Contact the personnel department for details.,-el,force,
preliminary,"[Adj] first step, before the main thing",,The preliminary results look promising.,prih-lihmihnuhri,"initial, introductory, preparatory","definitive, final"
prominent,[Adj] famous and important,,She's a prominent figure in the industry.,prahmihnuhnt,"attention-grabbing, eye-catching, flashy, eminent, forestanding",
revenue,[N] money a business earns,,Revenue increased by 15% this quarter.,rehvuhnyu,"gross, taxation, tax revenue, receipts, tax income",
scrutinize,[V] to look at something very carefully,,The auditor scrutinized every transaction.,skrutihneyez,"inspect, audit, take stock, size up",
strategy,[N] a plan to reach a goal,,We need a new marketing strategy.,stratuhyi,generalship,
subsidiary,[N] a smaller company owned by a bigger one,,The subsidiary operates in three countries.,suhb-sih-di-uhr-i,"subordinate, adjunct, auxiliary, ancillary, adjuvant",
tenant,[N] a person who pays to live in someone's place,,The tenant signed a two-year lease.,teh-nuhnt,renter,
terminate,[V] to end something / to fire someone from a job,,His contract was terminated early.,tɜmihnayt,"dismiss, fire, cease, end, sack","engage, employ, commence"
unanimous,"[Adj] everyone agrees, no one disagrees",,The decision was unanimous.,yu-nanihmuhs,"solid, accordant, consentaneous, unvaried, consentient",
vendor,[N] a person or company that sells things,,We're looking for a new vendor.,vehn-duh,"trafficker, vender, seller",
versatile,[Adj] can do many different things well,,She's a versatile employee who can do many tasks.,vɝsuhtl̩,"skilled, various, varied, variable, flexible",
yield,[V/N] to produce or give / profit from an investment,,The investment yielded a 10% return.,yild,"bear, capitulate, cede, defer, give in",
absolutely,"[Adv] 100%, totally, for sure","[Adv] อย่างแน่นอน, อย่างสมบูรณ์",I absolutely agree with you.,ab-suh-l(y)ut-lih,"dead, utterly, perfectly",
access,[N/V] a way to get in or use something,"[N/V] การเข้าถึง, เข้าถึง",Employees can access the system remotely.,aksehs,"approach, entree, admittance, memory access, get at",
achievement,[N] something great you did,"[N] ความสำเร็จ, ผลงาน",Winning the award was a great achievement.,uh-chivmuhnt,accomplishment,
acknowledge,[V] to say you know about something or accept it,"[V] ยอมรับ, รับทราบ",Please acknowledge receipt of this email.,uhk-nah-lihy,"admit, allow, avow, concede, confess",
adapt,[V] to change yourself to fit a new situation,"[V] ปรับตัว, ดัดแปลง",You need to adapt to the new system.,uh-dapt,"embrace, accommodate, conform, espouse, adjust",
adequate,"[Adj] enough, good enough","[Adj] เพียงพอ, พอเหมาะ",The budget is adequate for this project.,,"acceptable, correspondent, proportionate, satisfactory, sufficient",inadequate
adjust,[V] to change a little to make it better,"[V] ปรับ, แก้ไข",We need to adjust the schedule.,uh-yuhst,"set, conform, adapt, align, line up",skew
administration,[N] the people who run a company or organization,"[N] การบริหาร, ฝ่ายบริหาร",The administration approved the request.,uhd-mihnuh-strayshuhn,"conduct, governing, management, organization, regulation",
adopt,[V] to start using something new / to take a child as your own,"[V] นำมาใช้, รับเลี้ยง",The company adopted a new policy.,uh-dahpt,"acquire, take, espouse, assume, follow",
advance,[N/V] to move forward / ahead of time,"[N/V] ความก้าวหน้า, ล่วงหน้า",Please book in advance.,uhd-vans,"accelerate, adduce, aggrandize, allege, assign","regress, regression, retract"
agenda,[N] a list of things to talk about in a meeting,"[N] วาระการประชุม, กำหนดการ",What's on today's agenda?,uh-yehn-duh,"docket, schedule, worklist",
aggressive,[Adj] very strong and pushy,"[Adj] ก้าวร้าว, เชิงรุก",They took an aggressive marketing approach.,uh-grehs-ihv,"belligerent, rapacious, contentious, truculent, assertive","unaggressive, nonaggressive"
alternative,[N/Adj] another choice,[N/Adj] ทางเลือก,Is there an alternative solution?,ahl-tɜ(r)-nuh-tihv,"unconventional, choice, option, secondary, disjunctive",
annual,[Adj] happens once a year,[Adj] ประจำปี,The annual report will be published next week.,an-yu-uhl,"yearly, one-year, yearbook","perennial, scouring, biennial"
anticipate,[V] to expect something to happen,"[V] คาดการณ์, คาดหวัง",We anticipate strong demand this quarter.,an-tihs-ih-payt,"call, forestall, foretell, occur, foresee",
apparent,"[Adj] easy to see, obvious","[Adj] ชัดเจน, เห็นได้ชัด",It was apparent that changes were needed.,uh-pa-ruhnt,"ostensible, manifest, plain, evident, obvious",
applicant,[N] a person who applies for a job,[N] ผู้สมัคร,We received 200 applicants for the position.,ap-luh-kihnt,applier,
appropriate,[Adj] right for the situation,[Adj] เหมาะสม,Please wear appropriate attire.,,"pertinent, apropos, seize, proper, right",inappropriate
approval,"[N] saying yes, giving permission",[N] การอนุมัติ,The project is pending approval.,uh-pruvuhl,"commendation, blessing, approving, favorable reception",disapproval
aspect,[N] one part or side of something,"[N] แง่มุม, ด้าน",We need to consider every aspect of the plan.,aspehkt,"appearance, blee, look, facet",
assess,[V] to look at something and decide how good it is,[V] ประเมิน,We'll assess the situation and decide.,uh-sehs,"appraise, evaluate, value, measure, tax",
assign,[V] to give someone a task to do,[V] มอบหมาย,The manager assigned tasks to each team member.,uh-seyen,"arrogate, attribute, ascribe, delegate, designate",
associate,[V/N] to connect things together / a coworker,"[V/N] เชื่อมโยง, ผู้ร่วมงาน",He's an associate at the law firm.,uh-suhuusi-uht,"familiar, companion, fellow, link, comrade",dissociate
assume,[V] to think something is true without checking,"[V] สันนิษฐาน, รับหน้าที่",I assume you've read the report.,uh-sum,"arrogate, acquire, sham, presume, take",
assure,[V] to tell someone everything will be okay,"[V] รับรอง, ทำให้มั่นใจ",I assure you the issue will be resolved.,uh-shaw,"ascertain, control, secure, see, check",worry
authorize,[V] to give official permission,"[V] อนุญาต, ให้อำนาจ",Only managers can authorize purchases over $500.,ahthuhreyez,"clear, pass, authorise",
aware,[Adj] you know about it,"[Adj] ตระหนัก, รู้ตัว",Are you aware of the new policy?,uh-wer,"evocative, cognizant, redolent, knowledgeable, mindful","unaware, mindless, unwitting"
bid,[N/V] to offer a price / an offer in a competition,"[N/V] การเสนอราคา, ประมูล",Three companies submitted bids for the project.,bihd,"tender, command, entreat, call, adjure",
boost,[V/N] to make something go up or get better,"[V/N] เพิ่ม, กระตุ้น",The campaign helped boost sales.,bust,"advance, encourage, promote, rise, further",
brief,[Adj/V] short and quick / to give someone key info fast,"[Adj/V] สั้น, กระชับ, สรุปให้ฟัง",Let me give you a brief overview.,brif,"concise, short, little, abbreviated, legal brief",
candidate,[N] a person trying to get a job or position,"[N] ผู้สมัคร, ตัวเลือก",She's the top candidate for the job.,kan-dihduht,"prospect, nominee, campaigner",
capable,[Adj] able to do something well,[Adj] มีความสามารถ,He's very capable of handling the project.,kaypuhbl̩,"adequate, competent, susceptible, confident, resourceful",incapable
circumstance,[N] the situation around something,"[N] สถานการณ์, เหตุการณ์","Under the circumstances, we had no choice.",-ans,"condition, consideration, context",
clarify,[V] to explain so it's easier to understand,"[V] ชี้แจง, ทำให้ชัดเจน",Could you clarify what you mean?,klarihfeye,"elucidate, clear, illuminate, enlighten, shed light on","obscure, obfuscate, blur"
commitment,[N] a promise to do something / being dedicated,"[N] ความมุ่งมั่น, พันธสัญญา",We appreciate your commitment to quality.,,"dedication, allegiance, loyalty, consignment, committal",
commodity,[N] a basic product that is bought and sold (like oil or rice),"[N] สินค้า, สิ่งของ",Oil is a valuable commodity.,kuh-mahduhti,goods,
comparable,[Adj] similar enough to compare,[Adj] เทียบเคียงได้,The two products are comparable in quality.,kuhm-paruhbl̩,"corresponding, like, same","incomparable, uncomparable"
competitive,[Adj] trying hard to win / (price) as good as others,"[Adj] แข่งขัน, มีความสามารถในการแข่งขัน",We offer competitive salaries.,kuhm-pehtihtihv,"aggressive, militant, combative, agonistic, emulous",noncompetitive
component,[N] one piece of something bigger,[N] ส่วนประกอบ,Each component was tested individually.,kuhm-pohnuhnt,"element, constituent, part, factor, portion",
concern,[N/V] a worry / to be about something,"[N/V] ความกังวล, เกี่ยวข้อง",Safety is our main concern.,kuhn-sɜn,"vexation, touch, worry, interest, pertain",unconcern
conduct,[V/N] to do or carry out something / how you behave,"[V/N] ดำเนินการ, ความประพฤติ",We will conduct a survey next month.,kahnduhkt,"convey, demeanor, lead, direct, channel",
conference,[N] a big meeting where people discuss topics,[N] การประชุม,The conference is held annually in March.,kahn-fuh-ruhns,"group discussion, league",
confidential,"[Adj] secret, private, don't share it",[Adj] เป็นความลับ,This information is strictly confidential.,kahnfih-dehnshl,"close, secret, private, closet, classified",
consequence,[N] what happens because of something,[N] ผลที่ตามมา,There will be consequences for missing deadlines.,kahnsihkwehns,"issue, effect, outcome, result, aftermath",inconsequence
considerable,"[Adj] quite a lot, big enough to matter","[Adj] มาก, สำคัญ",We've made considerable progress.,kuhn-sihduhruhbl̩,"significant, substantial, extensive, sizeable, extended",inconsiderable
consistent,"[Adj] always the same, doesn't change","[Adj] สม่ำเสมอ, คงที่",Quality must be consistent across all products.,kuhn-sihstuhnt,"concordant, accordant, coherent, orderly, ordered","inconsistent, irreproducible, unreproducible"
constraint,[N] something that limits what you can do,[N] ข้อจำกัด,Budget constraints limit our options.,kuhn-straynt,restraint,
consult,[V] to ask an expert for advice,"[V] ปรึกษา, หารือ",You should consult a lawyer.,,"confabulate, refer, confab, look up, confer with",
contribute,[V] to give or help with something,"[V] มีส่วนร่วม, บริจาค",Everyone contributed to the project's success.,kuhn-t(sh)rihb-yut,"impart, lead, give, bestow, conduce",
controversy,[N] when people strongly disagree about something,[N] ข้อโต้แย้ง,The decision caused some controversy.,kahntruh-vɝsi,"contention, tilt, argument, contestation, arguing",
convention,[N] a big event or meeting / the normal way of doing things,"[N] การประชุมใหญ่, ธรรมเนียม",The industry convention is next month.,kuhn-vehn-shuhn,"pattern, rule, normal, formula, convening",unconventionality
convince,[V] to make someone believe or agree,"[V] โน้มน้าว, ทำให้เชื่อ",She convinced the board to approve the plan.,kuhn-vihns,"convert, turn, win over",
corporate,[Adj] related to a big company,"[Adj] ของบริษัท, องค์กร",The corporate office is in New York.,kawp(uh)ruht,"corporeal, joint, collective, incarnate, corporal",
correspond,[V] to match / to write messages to each other,"[V] ติดต่อ, สอดคล้อง",The numbers don't correspond with the report.,kahruh-spahnd,"fit, check, represent, jibe, match","disaccord, disagree, discord"
criteria,[N] the rules used to judge or decide,"[N] เกณฑ์, มาตรฐาน",What are the criteria for selection?,kreye-teerr-i-uh,,
crucial,"[Adj] super important, you can't skip it","[Adj] สำคัญมาก, ชี้ขาด",Timing is crucial for this launch.,kru-shuhl,"critical, essential, important, pivotal, relevant",noncrucial
deadline,[N] the last day you can finish something,"[N] กำหนดส่ง, เส้นตาย",The deadline is next Friday.,dehd-leyen,,
decade,[N] 10 years,[N] ทศวรรษ,The company has grown a lot over the past decade.,duh-kayd,"x, tenner, ten, decennary, decennium",
decline,[V/N] to go down / to say no,"[V/N] ลดลง, ปฏิเสธ",Sales declined by 5% last month.,dih-kleyen,"decay, reject, diminution, fall, wane","ameliorate, improve, meliorate"
demonstrate,[V] to show how something works,"[V] แสดงให้เห็น, สาธิต",Let me demonstrate how it works.,dehmuhnstrayt,"ascertain, exhibit, manifest, present, establish","confute, disprove"
despite,[Prep] even though,[Prep] ทั้งๆ ที่,"Despite the rain, the event was a success.",dih-speyet,,
detect,[V] to find or notice something,"[V] ตรวจจับ, ค้นพบ",The system can detect errors automatically.,dih-tehkt,"observe, find, notice, discover",
determine,[V] to find out or decide,"[V] กำหนด, ตัดสินใจ",We need to determine the root cause.,dih-tɜmihn,"ascertain, set, influence, shape, see",
devote,[V] to give all your time and energy to something,"[V] อุทิศ, ทุ่มเท",She devoted her career to education.,dih-vuhuut,"give, commit, dedicate, pay",
dimension,[N] a size or measurement / a side of a topic,"[N] มิติ, ขนาด",Consider every dimension of the problem.,deye-mehnshuhn,"attribute, proportion, property",
discipline,[N] controlling yourself to follow rules / a subject area,"[N] วินัย, สาขาวิชา",Success requires discipline.,dih-suh-plihn,"subject, field, check, study, train","indiscipline, undiscipline"
disclose,[V] to tell something that was secret,[V] เปิดเผย,The company refused to disclose the details.,dihs-kluhuuz,"bring to light, expose, reveal, impart, make known","cover up, withhold"
dispute,[N/V] a fight or argument about something,"[N/V] ข้อพิพาท, โต้แย้ง",The dispute was resolved through mediation.,dihs-pyut,"conflict, challenge, gainsay, quarrel, argufy",
distinct,[Adj] clearly different from others,"[Adj] ชัดเจน, แตกต่าง",There are two distinct categories.,dihs-tihngkt,"sharp, clear, crisp, trenchant, different",indistinct
distribute,[V] to give out to many people,"[V] แจกจ่าย, กระจาย",Flyers were distributed to all attendees.,dih-strihbyut,"categorize, sort, courier, allot, dispend",
domestic,[Adj] inside your own country / related to home,"[Adj] ภายในประเทศ, ในบ้าน",Domestic flights depart from Terminal 1.,duh-mehstihk,"municipal, native, internal, tamed, husbandly","foreign, undomestic"
dominate,[V] to be the biggest or strongest,"[V] ครอบงำ, มีอิทธิพล",The brand dominates the market.,dahmuh-nayt,"command, prevail, overlook, master, rule",
draft,[N/V] a first version that's not finished yet,"[N/V] ร่าง, ฉบับร่าง",I'll send you the first draft by Monday.,draft,swig,
duration,[N] how long something lasts,[N] ระยะเวลา,The course duration is 6 weeks.,dyuu-rayshn,"continuance, length",
efficient,[Adj] does the job well without wasting time or money,[Adj] มีประสิทธิภาพ,The new process is much more efficient.,uh-fihshuhnt,"prompt, competent, expeditious, effective, streamlined",inefficient
eliminate,[V] to remove completely,"[V] กำจัด, ตัดออก",We need to eliminate unnecessary costs.,ih-lihmuhnayt,"void, obviate, pass, reject, eradicate","necessitate, demand, need"
emerge,[V] to come out or appear,"[V] ปรากฏ, เกิดขึ้น",New trends are emerging in the market.,i-mɜd͡zh,"come forth, forthcome, heave in sight",
emphasize,[V] to say something is very important,"[V] เน้น, ย้ำ",I want to emphasize the importance of safety.,ehm-fuh-seyez,"accentuate, stress, accent, underscore, punctuate","destress, deemphasize"
enable,[V] to make it possible for something to happen,[V] ทำให้สามารถ,This tool enables remote collaboration.,ih-naybuhl,,"disable, incapacitate, disenable"
encounter,[V/N] to meet or face something (often unexpected),"[V/N] พบเจอ, เผชิญ",We encountered a few problems along the way.,ihn-kowntuh,"brush, see, play, chance, hit",
enhance,[V] to make something better,"[V] เพิ่มพูน, ปรับปรุง",The update will enhance user experience.,ihn-hahns,"raise, heighten",
enormous,[Adj] very very big,"[Adj] มหาศาล, ใหญ่โต",The project requires an enormous budget.,ih-naw(r)muhs,"tremendous, large, big",
ensure,[V] to make sure something happens,[V] ทำให้แน่ใจ,Please ensure all doors are locked.,ihn-shaw,"ascertain, control, assure, secure, see",
enterprise,[N] a business or big project,"[N] กิจการ, วิสาหกิจ",She runs a small enterprise.,ehntɚ-preyez,"endeavor, initiative, endeavour, go-ahead, enterprisingness",
entire,"[Adj] all of it, the whole thing",[Adj] ทั้งหมด,The entire team was involved.,uhn-teyeuh,"full, smooth, total, intact, whole",
equivalent,[Adj/N] the same amount or value,[Adj/N] เทียบเท่า,One mile is roughly equivalent to 1.6 km.,ih-kwihvuhluhnt,"like, same, equal, eq, equivalent weight","unequal, unlike"
establish,[V] to start or create something new,"[V] ก่อตั้ง, สร้าง",The company was established in 1990.,ih-stab-lihsh,"base, demonstrate, constitute, show, give","confute, get rid of, disprove"
evident,"[Adj] easy to see, clear","[Adj] ชัดเจน, เห็นได้ชัด",It's evident that we need more staff.,eh-vih-duhnt,"manifest, plain, apparent, obvious, discernible",
exceed,"[V] to go over the limit, more than expected","[V] เกิน, มากกว่า",Sales exceeded expectations.,ihk-sid,"pass, surmount, transcend, top, surpass",
exception,[N] something that doesn't follow the rule,[N] ข้อยกเว้น,No exceptions will be made.,uhk-sehpshuhn,exclusion,"commonness, generality"
excessive,[Adj] way too much,[Adj] มากเกินไป,Excessive overtime is not encouraged.,ihk-sehsihv,"exuberant, extravagant, unrestrained, overweening, immoderate",
exhibit,[V/N] to show something to the public / a display,"[V/N] จัดแสดง, นิทรรศการ",The museum will exhibit new artwork next month.,ehg-,"showing, exhibition, exposition, show, demonstrate",
expand,[V] to get bigger or grow,[V] ขยาย,We plan to expand into new markets.,ehk-spand,"expound, flourish, expatiate, amplify, elaborate",
expertise,[N] being very skilled at something,[N] ความเชี่ยวชาญ,Her expertise in finance is impressive.,ehkspɚ-tis,expertness,
explicit,"[Adj] said very clearly, no confusion","[Adj] ชัดแจ้ง, โจ่งแจ้ง",The instructions were very explicit.,ihk-splihsiht,"raunchy, express, manifest, overt","circumspect, implicit, unexplicit"
expose,[V] to show something that was hidden,"[V] เปิดเผย, เผย",The report exposed several issues.,ihk-spuhuuz,"impart, exhibit, display, break, divulge",cover
extend,[V] to make longer or bigger,"[V] ขยาย, ต่อเวลา",Can we extend the deadline by one week?,ehk-stehnd,"enlarge, expand, increase, inherit, lengthen",
extensive,"[Adj] very wide, covers a lot","[Adj] กว้างขวาง, ครอบคลุม",She has extensive experience in marketing.,ehks-tehn-sihv,"comprehensive, copious, abundant, considerable, large",intensive
extract,[V/N] to pull out or take out,"[V/N] สกัด, ดึงออก",We need to extract data from the database.,,"elicit, evoke, educe, express, selection",
feasible,"[Adj] can be done, possible","[Adj] เป็นไปได้, ทำได้",Is this plan feasible within our budget?,fizuhbuhl,"achievable, doable, possible, practicable, workable","infeasible, unfeasible"
flexible,"[Adj] can change easily, not strict",[Adj] ยืดหยุ่น,We offer flexible working hours.,flehk-suh-buhl,"pliant, versatile, pliable, elastic, adaptable","inflexible, uncompromising"
forecast,[N/V] a guess about what will happen (like weather),"[N/V] พยากรณ์, คาดการณ์",The weather forecast says rain tomorrow.,fawkahst,"presage, augur, reckon, figure, portend",
formal,"[Adj] official, follows rules and traditions",[Adj] เป็นทางการ,Please send a formal invitation.,fawmuhl,"solemn, perfunctory, positive, conventional, elegant","informal, genus doliolum"
former,"[Adj] from before, previous","[Adj] อดีต, ก่อนหน้า",The former CEO retired last year.,fawmuh,"quondam, other, previous, erstwhile, early",latter
foundation,[N] the base of something / a charity organization,"[N] มูลนิธิ, รากฐาน",Trust is the foundation of any relationship.,fown-dayshuhn,"base, groundwall, basis, groundwork, establishment","abolition, dissolution, ruination"
fundamental,[Adj] very basic and important,"[Adj] พื้นฐาน, สำคัญ",This is a fundamental change in policy.,fuhnduh-mehntuhl,groundlaying,
generate,[V] to create or produce,"[V] สร้าง, ผลิต",The campaign generated a lot of interest.,yehn-uhr-ayt,"yield, render, give, engender, return",
genuine,"[Adj] real, not fake","[Adj] แท้จริง, จริงใจ",He showed genuine concern for the team.,yehnyu-eyen,"authentic, lubish, natural, real, true","fake, ingenuine"
grant,[N/V] money given for a purpose / to give officially,"[N/V] เงินทุน, มอบให้",The government granted funding for the project.,grahnt,"yield, concede, accord, cede, give","refuse, deny"
guideline,[N] a rule or tip that helps you do something right,"[N] แนวทาง, หลักเกณฑ์",Please follow the company guidelines.,,"rule of thumb, guidepost",
headquarters,[N] the main office of a company,[N] สำนักงานใหญ่,Our headquarters is in Bangkok.,hehd-kwaw-tuhz,"home office, main office, central office, hq, military headquarters",
hesitate,[V] to stop for a moment because you're not sure,[V] ลังเล,Don't hesitate to ask questions.,hehzihtayt,"pause, swiver, waver",
highlight,[V/N] to point out the most important part,"[V/N] เน้น, จุดเด่น",I'd like to highlight a few key points.,heye-leyet,"spotlight, foreground, play up, highlighting, high spot","background, play down"
ideal,"[Adj/N] the best, perfect","[Adj/N] อุดมคติ, เหมาะสมที่สุด",This is the ideal location for our office.,eye-di-uhl,"apotheosis, paragon, abstract, nonpareil, perfect",
identify,[V] to find out what something is,"[V] ระบุ, บ่งชี้",We need to identify the problem first.,eye-dehn-tih-feye,"key, describe, distinguish, name, key out",
illustrate,[V] to explain by showing examples,"[V] แสดงให้เห็น, อธิบาย",Let me illustrate with an example.,ih-luhs-trayt,"exemplify, instance",
impact,[N/V] a big effect on something,[N/V] ผลกระทบ,The policy had a huge impact on sales.,,"touch, affect, encroachment, shock, impingement",
imply,[V] to mean something without saying it directly,[V] บอกเป็นนัย,Are you implying that I made a mistake?,ihm-pleye,"mean, entail, connote, involve, incriminate",
impose,[V] to force a rule or tax on someone,"[V] กำหนด, บังคับ",The government imposed new regulations.,ihm-puhuuz,"enforce, visit, levy, bring down, inflict",
indicate,[V] to show or point to something,"[V] บ่งชี้, ระบุ",The data indicates a positive trend.,ihndihkayt,"show, point, bespeak, suggest, betoken",contraindicate
initiative,[N] doing something first without being told / a new plan,"[N] ความคิดริเริ่ม, โครงการ",She took the initiative to start the project.,ih-nihshuhtihv,"maiden, opening, inaugural, first, initiatory",
inquire,[V] to ask for information,[V] สอบถาม,I'd like to inquire about the job opening.,ihn-kweyeuh,frain,
